{
  "schema_version": 1,
  "id": "direct-laborer-request-is-read-only",
  "name": "Direct Laborer invocation remains read-only",
  "category": "routing",
  "regression": { "real_case": false, "source": "Issue #6 direct role invocation coverage" },
  "setup": {},
  "turns": [{ "user_prompt": "阿强查一下最近的内存峰值来自哪里" }],
  "expect": [
    { "path": "/workers/0/id", "operator": "equals", "value": "laborer" },
    { "path": "/workers", "operator": "length_equals", "value": 1 },
    { "path": "/read_only", "operator": "equals", "value": true }
  ],
  "must_not": [
    { "path": "/actions", "operator": "contains", "value": "modify-product-code" }
  ]
}
